Product ID,Product Name,Category,Sub-category,Price (INR),Ingredients,Skin Type,Benefits,Rating,Stock Available,Launch Date,Vegan,Cruelty-Free
1001,Mamaearth Onion Hair Oil,Hair Care,Hair Oil,399,"Onion Oil, Coconut Oil, Vitamin E",All Skin Types,"Reduces hair fall, promotes hair growth",4.5,1200,01-05-2020,Yes,Yes
1002,Mamaearth Vitamin C Face Cream,Skin Care,Face Cream,499,"Vitamin C, Hyaluronic Acid, Saffron",Normal to Dry,"Brightens skin, evens skin tone",4.6,2500,15-03-2021,Yes,Yes
1003,Mamaearth Charcoal Body Wash,Body Care,Body Wash,349,"Charcoal, Tea Tree, Aloe Vera",All Skin Types,"Detoxifies skin, removes impurities",4.4,1800,20-11-2020,Yes,Yes
1004,Mamaearth Tea Tree Face Wash,Skin Care,Face Wash,299,"Tea Tree Oil, Aloe Vera",Oily & Acne,"Prevents acne, controls oil production",4.3,1500,10-07-2020,Yes,Yes
1005,Mamaearth Anti-Hair Fall Shampoo,Hair Care,Shampoo,399,"Biotin, Caffeine, Aloe Vera",All Hair Types,"Reduces hair fall, nourishes scalp",4.7,1300,01-01-2021,Yes,Yes
1006,Mamaearth Ubtan Face Mask,Skin Care,Face Mask,399,"Turmeric, Saffron, Aloe Vera",All Skin Types,"Brightens skin, removes tan",4.8,1100,01-06-2021,Yes,Yes
